commit	sharpe	sharpe_ci_low	max_dd_pct	pnl_usd	trades	status	description	over_spy_pct
1090c3b	0.0146	-1.7640	-3.14	2.98	9	discard	exp182: 180d top10 diversification	42.634
e94b381	0.4304	-1.7376	-3.08	263.20	1	discard	exp183: 180d filter stale symbols	31.590
e182351	0.6524	-1.3263	-4.11	492.60	3	discard	exp184: 180d top4 canonical	29.705
3b12c45	0.0087	-2.0974	-3.16	-3.02	3	discard	exp186: fresh 2 epoch pretrain with async refresh	24.824
1f2fa6a	1.4204	-0.6761	-1.89	889.40	3	discard	exp187: calendar session features fresh train	50.473
9affd07	0.5648	-1.5578	-1.66	327.29	9	discard	exp188: calendar top10 cached canonical	36.319
301a6bb	0.8658	-1.2017	-1.32	437.61	19	discard	exp189: calendar top20 cached canonical	34.870
07ea1a6	0.0073	-2.0974	-1.87	-2.25	3	discard	exp190: calendar top4 double 4h cached	29.660
b4ba841	-0.3733	-2.5802	-2.47	-305.93	3	discard	exp191: SPY trend context fresh train	19.195
1680fdc	0.9284	-1.2993	-2.80	435.04	3	discard	exp192: SPY-only timing profile evaluation	22.780
dbb6c2d	0.6172	-1.2279	-20.17	2485.78	3	discard	exp193: full-budget score allocation cached	0.310
ba16a06	0.9386	-1.7702	-9.79	3321.83	1	discard	exp194: canonical SPY 4h timing cached	0.238
b947168	0.0000	0.0000	0.00	0.00	0	discard	exp195: transcript-inspired setup checker cached	25.509
abdb4ca	0.0000	0.0000	0.00	0.00	0	discard	exp196: relaxed setup checker cached	25.509
9a0a152	0.0000	-0.5197	-4.34	0.00	3	discard	exp197: setup checker daily scan cached	25.086
cc08afe	0.5696	-1.4714	-10.32	1535.23	8	discard	exp198: score weighted top10 canonical cached	68.433
2871575	0.5696	-1.4714	-10.32	1535.23	8	discard	exp199: capped score weighted top10 cached	68.433
0707001	0.7023	-1.1710	-9.11	1838.18	10	discard	exp200: derisked score weighted top10 cached	69.374
6dd5ccd	0.2194	-1.6172	-17.01	726.03	3	discard	exp201: derisked score weighted top5 cached	1.225
cb33fa2	0.7023	-1.1710	-9.11	1838.18	10	discard	exp202: alpha over SPY score top10 cached	69.374
91c972f	0.7138	-1.1460	-6.93	1421.73	10	discard	exp203: lower exposure score top10 cached	61.044
7ce2a37	0.7052	-1.1584	-8.03	1626.82	10	discard	exp204: mid exposure score top10 cached	64.236
d181342	0.7268	-1.1355	-5.81	1215.24	10	discard	exp205: half exposure score top10 cached	51.758
cb9f0cf	0.9386	-1.7702	-9.79	3321.83	1	discard	exp206: SPY one day timing canonical cached	0.238
bd7e814	-0.8299	-2.5944	-19.00	-3008.23	9	discard	exp207: top100 LeWorld JEPA, canonical score top10 SPY-trend; top20 diagnostic beat SPY	1.825
d532e36	0.6031	-1.7095	-2.62	391.01	19	discard	exp208a: top100 LeWorld JEPA cached top20 canonical after temporal continuation	25.620
d532e36	0.4963	-1.7775	-2.64	312.91	19	discard	exp208b: top100 cross-symbol hard JEPA top20 canonical	26.817
bf1bed0	0.8558	-1.4460	-2.15	548.02	19	discard	exp209: one-seed MPS long mixed JEPA top20 canonical	35.165
